Title,Sentiment Compound,Sentiment Negative,Sentiment Neutral,Sentiment Positive,Published At
"제이씨현시스템, 기가바이트 지포스 RTX 50 시리즈 공식 출시",0.4939,0.0,0.968,0.032,2025-01-31T01:46:11Z
Senate Confirms Doug Burgum as Interior Secretary After Trump Tasked Him to Boost Drilling,0.7964,0.0,0.883,0.117,2025-01-31T01:43:22Z
Tom Brady Mailbag: Who is the best player 'the GOAT' ever faced in the Super Bowl?,0.9793,0.0,0.712,0.288,2025-01-31T01:42:21Z
Juego clásico de autos de Nintendo 64 llegará a Switch Online,-0.7246,0.083,0.917,0.0,2025-01-31T01:41:32Z
Christopher Nolan’s ‘The Odyssey’ Adds John Leguizamo,0.5267,0.0,0.945,0.055,2025-01-31T01:39:41Z
Intel’s stock inches up on solid earnings and revenue beat,-0.5445,0.13,0.746,0.124,2025-01-31T01:38:01Z
Budget Economic Survey 2025 Live Updates: FM Nirmala Sitharaman to table survey in Parliament today ahead of Union Budget 2025,0.2732,0.0,0.973,0.027,2025-01-31T01:35:38Z
Deepseek’s Security Risk Is A Critical Reminder For Healthcare CIOs,-0.1154,0.094,0.819,0.088,2025-01-31T01:35:17Z
Apple profit climbs but sales miss expectations,0.9239,0.07,0.734,0.196,2025-01-31T01:32:45Z
Samsung Electronics Posts 129.85% Jump In Q4 Operating Profit,0.4939,0.105,0.767,0.129,2025-01-31T01:30:30Z
Trump Media Taps Familiar Faces For Truth.Fi,0.8658,0.0,0.849,0.151,2025-01-31T01:30:28Z
"Google to Iran: Yes, we see you using Gemini for phishing and scripting. We're onto you",-0.0516,0.031,0.941,0.029,2025-01-31T01:30:11Z
Trump Raised Millions From Crypto Firms for His Inauguration,0.6597,0.0,0.928,0.072,2025-01-31T01:30:08Z
Panorama Data Insights Ltd.日本および世界の総入れ歯市場は、2031年までに32.5億米ドルに達し、年平均成長率（CAGR）8.6％で成長すると予測されています,0.0,0.0,1.0,0.0,2025-01-31T01:30:00Z
Innovative Nigerian Pharmacists Spearheading Healthcare Revolution,0.9081,0.0,0.827,0.173,2025-01-31T01:30:00Z
4 Reasons To Be Skeptical OpenAI’s $500B Stargate Project,-0.3182,0.026,0.974,0.0,2025-01-31T01:28:38Z
Apple Reports Q1 FY2025 Results,0.0,0.0,1.0,0.0,2025-01-31T01:27:48Z
Samsung Electronics posts 129.85% jump in Q4 operating profit,0.4939,0.053,0.86,0.088,2025-01-31T01:27:32Z
Logitech G502 HERO RGB Gaming Mouse - $59 + Delivery ($0 C&C/ in-Store) @ Umart,0.9804,0.0,0.755,0.245,2025-01-31T01:26:19Z
Failed Hamilton aquabike maker Manta5: Liquidators brace for millions in warranty claims,-0.2846,0.08,0.879,0.04,2025-01-31T01:24:05Z
US probes Chinese AI startup DeepSeek over possible Nvidia chip purchases via Singapore,-0.0516,0.035,0.921,0.044,2025-01-31T01:23:22Z
Efficient Austrian Railway Initiatives - Siemens is Working to Improve LEDs at Passenger Stations (TrendHunter.com),0.9136,0.0,0.822,0.178,2025-01-31T01:22:03Z
Winnipeg council approves new $13.5M police helicopter despite questions about cost,0.875,0.0,0.841,0.159,2025-01-31T01:18:32Z
"Stock Market Live Updates 31 January 2025: Stock to buy today: Mahindra & Mahindra (₹2,970.30) - BUY",0.9259,0.0,0.829,0.171,2025-01-31T01:14:44Z
"Share Market Highlights 31 January 2025: Markets continue rally as Economic Survey predicts pro-growth Budget; Sensex leaps 740 pts to close at 77,500, Nifty ends above 23,500",0.9022,0.014,0.859,0.127,2025-01-31T01:14:44Z
Mark Zuckerberg's Meta Agrees to Pay Trump a Huge Settlement in Censorship Lawsuit,0.5574,0.102,0.762,0.136,2025-01-31T01:12:26Z
Apple Profit Climbs But Sales Miss Expectations,0.8735,0.079,0.741,0.181,2025-01-31T01:12:16Z
Samsung Electronics Announces Fourth Quarter and FY 2024 Results,0.8074,0.0,0.895,0.105,2025-01-31T01:12:05Z
"Figure Plans To Ship 100,000 Humanoid Robots Over Next 4 Years",0.3818,0.0,0.967,0.033,2025-01-31T01:11:04Z
TeamLab Planets Expands With New Immersive Experience,0.3612,0.0,0.958,0.042,2025-01-31T01:09:29Z
DeepSeek’s Rise Shows AI Security Remains a Moving Target,-0.4588,0.077,0.869,0.054,2025-01-31T01:09:23Z
World's Space Agencies Say Asteroid Has 1.3% Chance of Hitting Earth in 2032,0.6124,0.0,0.931,0.069,2025-01-31T01:05:59Z
タニタ、手のひら触れるだけで握力わかる新技術,0.743,0.0,0.69,0.31,2025-01-31T01:05:00Z
Congressional staffers 'unauthorized' to use DeepSeek,0.9081,0.0,0.861,0.139,2025-01-31T01:03:41Z
"Asian equities fall as Samsung, SK Hynix weigh",0.5466,0.065,0.833,0.103,2025-01-31T01:01:17Z
Proposal for a Form of Conditional Supplemental Income (CSI) in a Post-Work World,0.3818,0.0,0.963,0.037,2025-01-31T01:00:55Z
Hotel beds ‘hit different’ – that’s by design,-0.8791,0.172,0.828,0.0,2025-01-31T01:00:22Z
第4世代QD-OLED採用27型4Kゲーミングディスプレイ、ASUS「ROG Swift OLED PG27UCDM」国内発売日確定,0.6705,0.057,0.708,0.234,2025-01-31T01:00:15Z
Brave 1.74.51,0.9806,0.0,0.656,0.344,2025-01-31T01:00:02Z
China’s Boldest Oil Hunt Yet,0.5106,0.032,0.89,0.077,2025-01-31T01:00:00Z
SkyQuest Technology and Consulting Pvt. Ltd.RFID 市場は大幅な成長が見込まれ、2032 年までに 640.6 億ドルに達する見込み,0.0,0.0,1.0,0.0,2025-01-31T01:00:00Z
仕事体験の求人可能に　書類審査・面接なしで働ける,0.0,0.0,1.0,0.0,2025-01-31T01:00:00Z
Smoother communication breaking barriers in Tokyo with Transparent Display,-0.3182,0.047,0.927,0.025,2025-01-31T01:00:00Z
"Ram, Jeep, Dodge rev up US car production in another Trump win",0.5789,0.037,0.875,0.088,2025-01-31T01:00:00Z
STEM competition winner gets N15m scholarship,0.9081,0.0,0.868,0.132,2025-01-31T00:56:48Z
Will Smith Announces Latest Single and New Album,0.872,0.0,0.864,0.136,2025-01-31T00:56:38Z
DeekSeek AI: Call to ban app on Australian government devices over China fears,-0.9246,0.18,0.82,0.0,2025-01-31T00:56:06Z
How Zebra is empowering frontline workers through tech,0.8658,0.0,0.83,0.17,2025-01-31T00:56:00Z
New Technology May Get Home Humidity Under Control - Energy Technology Revolution,-0.9752,0.253,0.733,0.014,2025-01-31T00:55:42Z
Teens Are Losing Faith In Big Tech—And The Numbers Are Shocking,0.7783,0.075,0.753,0.172,2025-01-31T00:53:58Z
The Latest: Collision between passenger jet and Army helicopter near DC leaves no survivors,-0.9371,0.197,0.803,0.0,2025-01-31T00:52:37Z
Wise to Settle CFPB Allegations of Issues Around Advertisements and Disclosures,0.9337,0.037,0.736,0.227,2025-01-31T00:48:33Z
"11 years after a celebrated opening, massive solar plant faces a bleak future in the Mojave Desert",0.5574,0.028,0.9,0.073,2025-01-31T00:48:10Z
This new Google experiment uses AI to save you a phone call,0.8625,0.0,0.864,0.136,2025-01-31T00:40:08Z
Doug Burgum confirmed as interior secretary with support from Democrats,0.6597,0.0,0.908,0.092,2025-01-31T00:39:14Z
Q&A: OpenAI on rival DeepSeek and partnering with the government,0.5267,0.0,0.945,0.055,2025-01-31T00:37:11Z
Luxury Biotech Skincare Brands - AV Laboratories Skincare is The Future of Luxury Biotech Beauty (TrendHunter.com),0.802,0.0,0.886,0.114,2025-01-31T00:37:06Z
"5,826 graduate from FUTMinna, 119 bag first class",-0.5267,0.05,0.95,0.0,2025-01-31T00:35:16Z
Encore Unveils Innovative Learning Tools as It Attended FETC 2025,0.4404,0.0,0.957,0.043,2025-01-31T00:33:00Z
Contractors abandoned 129 projects despite payments – BudgIT,-0.8402,0.117,0.883,0.0,2025-01-31T00:31:51Z
"If You're A Homebody, It's Definitely Worth Splurging On These 23 Things This Winter",0.8779,0.065,0.709,0.226,2025-01-31T00:31:02Z
Experts for budget boost to guard digital space from threats,0.888,0.077,0.712,0.211,2025-01-31T00:31:00Z
India’s largest bank wants a closer look at all its branches,-0.607,0.06,0.927,0.013,2025-01-31T00:30:16Z
"Demand for Home Audio Equipment Set to Propel Market Growth to ~USD 94,230.5 Million by 2035 | Future Market Insights, Inc.",0.6808,0.043,0.869,0.088,2025-01-31T00:30:00Z
SkyQuest Technology and Consulting Pvt. Ltd.クラウド セキュリティ市場分析 2025-2032: 主要指標と予測,0.0,0.0,1.0,0.0,2025-01-31T00:30:00Z
AI mission takes off: Chip & model plans on board,0.4767,0.0,0.965,0.035,2025-01-31T00:30:00Z
Nikon unveils AI-incorporated camera,0.25,0.0,0.962,0.038,2025-01-31T00:24:10Z
DeepSeek’s AI restricted by ‘hundreds’ of companies in days,-0.6705,0.146,0.781,0.073,2025-01-31T00:22:00Z
"Past Presidents’ Market Performance, And Current Leaders/Laggards",0.8126,0.0,0.863,0.137,2025-01-31T00:15:02Z
Intel has already received $2.2B in federal grants for chip production | TechCrunch,0.8316,0.0,0.852,0.148,2025-01-31T00:13:32Z
Samsung’s Chip Profit Misses on Costly AI Memory Catchup Race,0.25,0.12,0.76,0.12,2025-01-31T00:12:44Z
Ryoncil® Commercial Launch Update and Product Pipeline,0.0,0.048,0.917,0.035,2025-01-31T00:11:00Z
"DeepSeek, AI And The Race To Keep Up: Key Takeaways For Global CIOs",-0.1027,0.02,0.98,0.0,2025-01-31T00:10:07Z
Rory McIlroy and Shane Lowry both hit holes-in-one at Pebble Beach Pro-Am,0.8462,0.0,0.882,0.118,2025-01-31T00:09:55Z
Senate advances Trump's energy secretary nominee to final confirmation vote,0.8074,0.0,0.856,0.144,2025-01-31T00:09:27Z
LG inaugurates UNIBEN solar-powered borehole,0.7717,0.0,0.903,0.097,2025-01-31T00:09:14Z
Senate confirms Doug Burgum as interior secretary after Trump tasked him to boost drilling,0.8934,0.0,0.862,0.138,2025-01-31T00:08:51Z
"My daughter is entering high school without a smartphone. Instead, I got her a phone without apps or WiFi.",-0.9022,0.142,0.858,0.0,2025-01-31T00:08:01Z
"11 years after a celebrated opening, massive solar plant faces a bleak future in the Mojave Desert",0.34,0.052,0.879,0.069,2025-01-31T00:07:49Z
Senate confirms Doug Burgum as interior secretary after Trump tasked him to boost drilling,0.4019,0.0,0.951,0.049,2025-01-31T00:06:18Z
How an AI written book shows why the tech 'terrifies' creatives,0.8126,0.048,0.791,0.161,2025-01-31T00:02:44Z
Lloyds appoints head of responsible AI,0.9313,0.053,0.689,0.258,2025-01-31T00:01:00Z
Bitcoin In Texas’ Future? Gov. Dan Patrick Unveils Reserve Plan,0.9371,0.0,0.832,0.168,2025-01-31T00:00:51Z
The New Balance 550 Slips Into A “Dream State”,0.9001,0.021,0.85,0.129,2025-01-31T00:00:18Z
Nasdaq 100 celebrates 40 years: Is crypto the next big driver for gains?,0.8658,0.0,0.84,0.16,2025-01-31T00:00:01Z
"Mini deal, macro focus: PM Modi to talk trade in US",0.6908,0.041,0.857,0.102,2025-01-31T00:00:00Z
Easy ways to optimize your costs,0.9559,0.0,0.778,0.222,2025-01-31T00:00:00Z
Principal Machine Learning Engineer,0.8475,0.0,0.865,0.135,2025-01-31T00:00:00Z
AI & Machine Learning Engineer – Manager – Consulting – Location OPEN,0.9698,0.0,0.794,0.206,2025-01-31T00:00:00Z
AI & Machine Learning Engineer – Manager – Consulting – Location OPEN,0.9698,0.0,0.794,0.206,2025-01-31T00:00:00Z
New mail and package program enhances convenience and cuts emissions,0.1779,0.037,0.915,0.048,2025-01-31T00:00:00Z
Angola’s Oil Sector Making A Comeback After OPEC Exit,-0.7506,0.084,0.916,0.0,2025-01-31T00:00:00Z
"Holistic analysis of Ganga basin water quality: a statistical approach with WQI, HMCI, HMQI and HRI indices",0.4404,0.0,0.964,0.036,2025-01-31T00:00:00Z
Precision design for high-performance TADF emitters with novel interlock D–A frameworks,0.5267,0.0,0.923,0.077,2025-01-31T00:00:00Z
"The Servo Blog: Servo in 2024: stats, features and donations",0.6705,0.025,0.905,0.07,2025-01-31T00:00:00Z
Machine Learning Engineer,0.1424,0.138,0.681,0.181,2025-01-31T00:00:00Z
Celebrating 10 years of #RSCPoster,0.765,0.0,0.912,0.088,2025-01-31T00:00:00Z
The strategic importance of platform engineering in modern software development,0.6868,0.0,0.935,0.065,2025-01-31T00:00:00Z
Elevating Jawwy telco architecture: a path to excellence with Red Hat OpenShift,0.9042,0.0,0.827,0.173,2025-01-31T00:00:00Z
