Title,Sentiment Compound,Sentiment Negative,Sentiment Neutral,Sentiment Positive,Published At
Tom Brady Mailbag: Who is the best player 'the GOAT' ever faced in the Super Bowl?,0.9793,0.0,0.712,0.288,2025-01-31T01:42:21Z
Trump Raised Millions From Crypto Firms for His Inauguration,0.6597,0.0,0.928,0.072,2025-01-31T01:30:08Z
4 Reasons To Be Skeptical OpenAI’s $500B Stargate Project,-0.3182,0.026,0.974,0.0,2025-01-31T01:28:38Z
Failed Hamilton aquabike maker Manta5: Liquidators brace for millions in warranty claims,-0.2846,0.08,0.879,0.04,2025-01-31T01:24:05Z
US probes Chinese AI startup DeepSeek over possible Nvidia chip purchases via Singapore,-0.0516,0.035,0.921,0.044,2025-01-31T01:23:22Z
Efficient Austrian Railway Initiatives - Siemens is Working to Improve LEDs at Passenger Stations (TrendHunter.com),0.9136,0.0,0.822,0.178,2025-01-31T01:22:03Z
DeepSeek’s Rise Shows AI Security Remains a Moving Target,-0.4588,0.077,0.869,0.054,2025-01-31T01:09:23Z
DeekSeek AI: Call to ban app on Australian government devices over China fears,-0.9246,0.18,0.82,0.0,2025-01-31T00:56:06Z
Teens Are Losing Faith In Big Tech—And The Numbers Are Shocking,0.7783,0.075,0.753,0.172,2025-01-31T00:53:58Z
This new Google experiment uses AI to save you a phone call,0.8625,0.0,0.864,0.136,2025-01-31T00:40:08Z
Q&A: OpenAI on rival DeepSeek and partnering with the government,0.5267,0.0,0.945,0.055,2025-01-31T00:37:11Z
AI mission takes off: Chip & model plans on board,0.4767,0.0,0.965,0.035,2025-01-31T00:30:00Z
Nikon unveils AI-incorporated camera,0.25,0.0,0.962,0.038,2025-01-31T00:24:10Z
DeepSeek’s AI restricted by ‘hundreds’ of companies in days,-0.6705,0.146,0.781,0.073,2025-01-31T00:22:00Z
Samsung’s Chip Profit Misses on Costly AI Memory Catchup Race,0.25,0.12,0.76,0.12,2025-01-31T00:12:44Z
"DeepSeek, AI And The Race To Keep Up: Key Takeaways For Global CIOs",-0.1027,0.02,0.98,0.0,2025-01-31T00:10:07Z
How an AI written book shows why the tech 'terrifies' creatives,0.8126,0.048,0.791,0.161,2025-01-31T00:02:44Z
Lloyds appoints head of responsible AI,0.9313,0.053,0.689,0.258,2025-01-31T00:01:00Z
Nasdaq 100 celebrates 40 years: Is crypto the next big driver for gains?,0.8658,0.0,0.84,0.16,2025-01-31T00:00:01Z
AI & Machine Learning Engineer – Manager – Consulting – Location OPEN,0.9698,0.0,0.794,0.206,2025-01-31T00:00:00Z
AI & Machine Learning Engineer – Manager – Consulting – Location OPEN,0.9698,0.0,0.794,0.206,2025-01-31T00:00:00Z
New mail and package program enhances convenience and cuts emissions,0.1779,0.037,0.915,0.048,2025-01-31T00:00:00Z
